排名,视频名,作者,IP地址,摘要,观看网址,观看次数,点赞数,收藏数,投币数,转发数
1,这场【全球审美大降级】属实给我整混乱了……,塑料叉FOKU,上海,审美水平真的下降了吗？,https://b23.tv/BV1fc41167r3,7122749,365551,102107,62916,17455
2,朋友你们帮我看看问题到底出现在哪里？,口技小青年,江苏,京中有善口技者,https://b23.tv/BV1ju4y1j7jk,6776206,457064,95215,105890,114216
3,【硬件科普】从零开始认识主板,硬件茶谈,河北,从零认识主板,https://b23.tv/BV1xQ4y1b7JS,2456443,222575,180830,144174,12482
4,满足了甲方奇怪的癖好,逗比的雀巢,四川,省流：甲方的脸都气黑了,https://b23.tv/BV1BC4y1j7dr,7998403,525147,52199,77052,13241
5,最传奇的上古帝王 | 从被虐待，到君临天下！,木鱼水心,北京,从孤苦少年，到第一位平民天子，舜帝是如何改写命运的？,https://b23.tv/BV12H4y1q7bx,1973156,214402,65656,159181,4327
6,章~鱼~哥~来~咯~,老番茄,韩国,省流：《章鱼村》,https://b23.tv/BV1Hw411K7Fx,3757717,283940,82476,127974,10998
7,当北方人第一次在南方过冬,粤知一二,广东,北方和南方不是同一种冷,https://b23.tv/BV1Gj411J76q,5740806,406621,29561,7893,5647
8,《绝区零》比利角色展示 | 骑士登场！,绝区零,上海, 欢迎来到新艾利都！,https://b23.tv/BV1tN4y1m7d5,3578796,379932,63883,71268,39371
9,《原神》过场动画-「罪人的终幕」,原神,上海,神爱众人，芙门永存,https://b23.tv/BV1vu4y1b7Y9,2867664,273326,101679,182492,25833
10,探秘中国国宴！开国第一宴！10道国宴菜！都吃什么？,HOLA小测佬,西班牙,吃国宴是一种什么样的体验,https://b23.tv/BV1Dz4y1N7XT,5373251,400652,51565,85972,10668
11,第一次去拍网红写真 没想到要穿露背装 当场崩溃,假美食po主,英国,浪浪体验拍写真,https://b23.tv/BV1Rj411j7Fq,2660681,120061,14823,43579,5164
12,这十六分钟真的能讲完你那波澜壮阔的十年吗,一张照片LOL,上海,Faker的登神之路,https://b23.tv/BV12a4y1S7GR,3486290,230870,102595,221145,52853
13,"""Cheems，你枪里装的是珍珠软糖吗？""",一大筐会飞的草莓,广东,猫和老鼠出新版了？,https://b23.tv/BV1dw411N7VG,2151866,203410,44108,34473,8404
14,3兄弟体验上海东北饺子馆菜量，被coco笑话冻死…,盗月社食遇记,上海,上海东北菜大测评,https://b23.tv/BV1CH4y127gA,2576285,148278,19049,87198,7132
15,红魔9Pro上手体验：教科书级游戏性能,极客湾Geekerwan,上海,红魔9Pro都有哪些亮点？,https://b23.tv/BV14M411f7R7,1853022,91847,8380,14127,14206
16,小伙用高智能AI生成的魔仙李云龙,主观哥哥,黑龙江,AI无法代替人类的证据（doge,https://b23.tv/BV11Q4y1t7mG,1272475,87342,17836,6959,9966
17,《无期迷途》全新主线章节——「弱者」,无期迷途,上海,期待新主线！,https://b23.tv/BV1Wg4y1X7oi,1672259,51370,11185,26807,10820
18,百炼成金，四冠登神！Faker无需向众神祈祷，因为众神传颂的都是你的名号！LOL史上第一人再登巅峰！,裴一言,辽宁,你的存在就是传奇,https://b23.tv/BV18N4y1S7vP,1744627,74066,28887,48284,6107
19,最 强 的 矛,某幻君,上海,最强的矛能有多强？,https://b23.tv/BV16N4y1m7bB,3125684,185296,20283,22527,920
20,【英雄联盟】2024赛季玩法介绍,英雄联盟,上海,准备迎接一月份的峡谷吧！,https://b23.tv/BV1sj411J7iS,1540587,63862,7082,6780,51461
21,四喜丸子,八零徐姥姥,辽宁,这么可爱又幽默的姥姥我也想要,https://b23.tv/BV14H4y1q7xq,1251640,130323,4887,9124,2555
22,生活中，我时常觉得自己有一些超能力,papi酱,北京,有点监视我生活了,https://b23.tv/BV17u4y157Jv,2417309,217676,6145,10587,4946
23,薛定谔的胖铁盒,幾加乘,广东,小馋猫历险记,https://b23.tv/BV1yC4y1m7Ur,1201526,157882,21860,47981,16332
24,【罗翔】张三弄虚作假却风生水起，做真好人真难！经验世界无法给人自洽，我们该怎么办？,罗翔说刑法,北京,不如像清风明月一样做好自己,https://b23.tv/BV1k94y1V7vV,1573494,159778,19335,32122,6300
25,完美解决祖父悖论！究极烧脑的悬疑科幻《前目的地》,培根悖论唠唠嗑,北京,爱上自己、生下自己、杀死自己的烧脑设定,https://b23.tv/BV1mC4y1m7Cz,2199130,85976,46789,16171,6717
26,《掠影纷争》首曝PV | 向世界挥拳,掠影纷争,上海,做自己的英雄，向世界挥拳,https://b23.tv/BV1rv411F7QD,1659122,16104,4670,2781,3668
27,【BA】钢铁侠大战美国队长！谁才是对的？！万字解析《美国队长3：内战》！,BuriedAlien,韩国,显微镜级别的美队3解读！,https://b23.tv/BV1hN4y1m7JS,1166672,69778,23876,46159,2346
28,大胆点，向前跑，我们的青春本该热烈。,大圆哥_,河南,趁着年轻勇敢去做吧,https://b23.tv/BV1uz4y1A71h,2439250,254017,27131,94964,9139
29,这是史上最会玩梗的游戏作者（,二控_,上海,这是什么宝藏游戏？,https://b23.tv/BV1fw411A7S9,1257683,32954,6243,1700,635
30,《重返未来：1999》1.5版本PV：复兴！乌卢鲁运动会,重返未来1999,广东,从交叠的指缝中，火光重新燃起,https://b23.tv/BV1PG411D7nH,1713068,72927,13451,22764,17749
31,花120w在韩国变美，结果丑到容貌焦虑…,小桑菜奈,浙江,韩国妆造真有那么神吗？,https://b23.tv/BV1eC4y1j7ya,1457107,43654,15902,4660,914
32,拥有我你就能拥有...,铃乃Chan,河南,百变声线,https://b23.tv/BV1cv411c7yk,941283,138975,18479,13933,3254
33,在 我 这 呐,頹男,河北,好活当赏,https://b23.tv/BV1Vj411J7PE,2515567,198471,27088,34969,12935
34,动态视频｜我们用记忆金属做了一盆花...,老师好我叫何同学,浙江,遇热绽放的金属花能有多美？,https://b23.tv/BV1gN411M7kh,5891136,1014139,142750,103080,25722
35,美的不真实…这是在动漫里跳舞吗！？,-小D-biu,重庆,绝美水中舞蹈,https://b23.tv/BV1xG411D7tt,603366,34860,9705,7846,974
36,【吸奇侠】第一奇书《金瓶梅》01 天饼星的陨落,吸奇侠,广东,减一分风月，添三分风趣，第一奇书奇在哪？,https://b23.tv/BV1hw411H79u,1275341,74301,27670,31305,6243
37,【影史上100个关于窗的镜头】“或许生活难免落俗，但浪漫至死不渝。”,白日妄想家,广东,100个关于窗户的经典镜头,https://b23.tv/BV1Jj411J75b,605599,79138,66034,19422,3715
38,对象家人出车祸了也会先陪我吃完火锅？,蜡笔小坨恰恰恰,重庆,有才UP，在线问诊！,https://b23.tv/BV1iu4y1b7Zb,2028799,164629,26588,91392,27272
